{
  "metadados": {
    "titulo": "Diagnóstico do risco: o paciente parcial e a expansão do acesso à PrEP no Brasil",
    "autor": "Rodrigo Antonio Devellis",
    "orientadora": "Márcia da Silva Mazon",
    "instituicao": "Universidade Federal de Santa Catarina",
    "curso": "Ciências Sociais",
    "grau": "licenciatura",
    "ano": 2026,
    "palavras_chave": [
      "PrEP",
      "adolescência",
      "HIV/aids",
      "PCDT",
      "medicalização do risco",
      "dispositivo",
      "biopolítica",
      "governamentalidade",
      "paciente parcial",
      "cidadania biológica"
    ]
  },
  "introducao": {
    "ideias_centrais": [
      "O PCDT de 2025 estende a PrEP a pessoas a partir de 15 anos e dispensa a autorização parental, sob sigilo; o adolescente é incorporado como sujeito elegível.",
      "O protocolo não apenas identifica um grupo já existente para protegê-lo: ao defini-lo, produz em parte a figura do adolescente sexualmente ativo, autônomo, compreendente e acompanhado.",
      "A investigação recusa causas, efeitos e méritos da medida e trata a inclusão do adolescente como objeto a descrever, e não a celebrar ou denunciar."
    ],
    "pergunta_de_pesquisa": "De que modo o protocolo torna o adolescente inteligível e governável — sexualmente ativo, autônomo, apto a compreender e a aderir ao acompanhamento — ao defini-lo como elegível?",
    "objetivo_geral": "Analisar, a partir de revisão teórica e bibliográfica, as condições sociais, históricas e teóricas que tornam possível a expansão do acesso à PrEP entre adolescentes de 15 a 19 anos no Brasil, articulando dispositivo, biopolítica, governamentalidade, medicalização e cidadania biológica ao caso codificado no PCDT (BRASIL, 2025).",
    "objetivos_especificos": [
      "Examinar a PrEP como tecnologia inscrita no dispositivo da aids, identificando os deslocamentos internos que sua incorporação produz na configuração brasileira da prevenção (Foucault, Conrad, Rose).",
      "Examinar o adolescente como categoria historicamente construída e como segmento-alvo da expansão, reconstituindo sua sociogênese e sua operacionalização no PCDT (critérios de elegibilidade, dispensa de autorização parental, marcadores etários, comportamentais e epidemiológicos)."
    ],
    "justificativa": "A inclusão do adolescente como sujeito elegível marca uma inflexão na política brasileira de prevenção ao HIV; o pouco examinado é o modo como essa entrada na política pública se organiza — por quais critérios, arranjos jurídicos e qual figura do adolescente.",
    "metodologia": "Pesquisa qualitativa, teórico-bibliográfica e documental. Corpus: o PCDT (BRASIL, 2025) como fonte central e o referencial teórico como categorias de leitura. Análise de inspiração genealógica, com o documento lido como elemento ativo (Prior). Limite assumido: a leitura se detém no plano da página, não nos usos do documento.",
    "quadro_teorico_minimo": [
      { "nome": "Dispositivo", "autor": "Foucault", "definicao": "Rede heterogênea de discursos, leis, normas e práticas que responde a uma urgência histórica e produz os sujeitos sobre os quais incide.", "fonte": "FOUCAULT, 1998" },
      { "nome": "Biopolítica e governamentalidade", "autor": "Foucault", "definicao": "A biopolítica toma a vida das populações como superfície de intervenção; a governamentalidade é a racionalidade e as tecnologias que conduzem condutas.", "fonte": "FOUCAULT, 2008" },
      { "nome": "Dispositivo da aliança x dispositivo da sexualidade", "autor": "Foucault", "definicao": "A família como permutador entre um regime centrado no parentesco/lei e outro centrado na clínica/exame.", "fonte": "FOUCAULT, 1999" },
      { "nome": "Medicalização e paciente parcial", "autor": "Conrad", "definicao": "Definir um problema em termos médicos é conferir jurisdição; a medicalização do risco trata como condição atual o que é probabilidade futura, e o paciente parcial medica um corpo sem doença.", "fonte": "CONRAD, 2006, 2007" },
      { "nome": "Política vital e cidadania biológica", "autor": "Rose", "definicao": "Modulação das capacidades vitais no plano molecular e reorganização de solidariedades e demandas em torno de estatutos biológicos, que também abrem a possibilidade de reivindicar a vida como direito.", "fonte": "ROSE, 2007" },
      { "nome": "Documento como elemento ativo", "autor": "Prior", "definicao": "O documento tem autoria distribuída (author-function) e participa da constituição daquilo que parece apenas registrar.", "fonte": "PRIOR, 2003" }
    ]
  },
  "capitulos": [
    {
      "numero": "1",
      "titulo": "Dispositivo e PCDT",
      "tese_do_capitulo": "O PCDT não se limita a reconhecer um grupo vulnerável para protegê-lo; ao defini-lo, estende o dispositivo da sexualidade no gesto mesmo com que protege, produzindo o adolescente como sujeito autônomo, compreendente e acompanhado.",
      "ideias_centrais": [
        "Vigiar e punir e A vontade de saber comparecem como forma/procedimento de leitura do dispositivo, não como conteúdo carcerário transposto ao protocolo.",
        "O dado epidemiológico não encontra o jovem como grupo de risco já dado: constitui-o como superfície de incidência.",
        "A dispensa da autorização parental desliga o permutador (família/aliança) e religa a sexualidade do adolescente ao dispositivo da sexualidade — à relação clínica.",
        "Direito (ECA, Código de Ética Médica) e sigilo não são limites a vencer, mas táticas mobilizadas: polivalência tática dos discursos.",
        "A autonomia é efeito produzido, não pressuposto, e vem amarrada à exigência de compreender a profilaxia e o acompanhamento — isto é, ao ingresso no monitoramento contínuo."
      ],
      "funcao_no_argumento": "Instala a analítica do dispositivo e a aplica ao PCDT, fixando a tese matriz (proteger e produzir num só gesto) que os capítulos seguintes desdobram.",
      "articulacao_com_objeto": "Lê os critérios de elegibilidade e a dispensa de autorização parental do PCDT como deslocamento de um regime de poder (aliança) a outro (sexualidade).",
      "conceitos_chave": [
        { "nome": "Dispositivo", "autor": "Foucault", "fonte": "FOUCAULT, 1998, p. 244-246" },
        { "nome": "Polivalência tática dos discursos", "autor": "Foucault", "fonte": "FOUCAULT, 1999, p. 96-97" },
        { "nome": "Permutador aliança/sexualidade", "autor": "Foucault", "fonte": "FOUCAULT, 1999, p. 100-106" }
      ],
      "autores_mobilizados": [
        { "nome": "Michel Foucault", "obras": ["Vigiar e punir", "História da sexualidade I", "Microfísica do poder"], "papel": "Fornece a analítica do dispositivo e a distinção aliança/sexualidade." }
      ],
      "citacoes_chave": [
        { "texto": "Os novos casos de aids se concentram, majoritariamente, na população jovem (15 a 24 anos).", "fonte": "BRASIL, 2025", "pagina": "11", "contexto": "Dado epidemiológico que abre a justificativa do protocolo e constitui o jovem como superfície de incidência." },
        { "texto": "Não sendo necessário o consentimento dos pais e/ou responsáveis.", "fonte": "BRASIL, 2025", "pagina": "21", "contexto": "Dispensa da autorização parental lida como desligamento do permutador." }
      ],
      "secoes": [
        { "numero": "1.1", "titulo": "Sobre a vigilância: suavizada e sofisticada", "ideias_centrais": ["A peça recusada pelo programa penal (a prisão) é a que vence: o dispositivo retém efeitos não previstos.", "O poder é produtivo: constitui a criança como sujeito sexual, não apenas interdita."] },
        { "numero": "1.2", "titulo": "Sexualidade livre mas produzida", "ideias_centrais": ["Afirmar o sexo pode ser mover-se conforme o traçado do dispositivo; a liberdade vivida não está fora do que a tornou possível."] },
        { "numero": "1.3", "titulo": "Definição", "ideias_centrais": ["O dispositivo é rede heterogênea, sistema móvel de relações e resposta estratégica a uma urgência; sobredeterminação funcional e preenchimento estratégico."] },
        { "numero": "1.4", "titulo": "A PrEP para adolescentes: a autonomia como inscrição no dispositivo", "ideias_centrais": ["A criança masturbadora retorna na cláusula do sujeito 'sexualmente ativo' em 'vulnerabilidade acrescida'.", "O sigilo abre o acesso em vez de suprimir; a autonomia é produzida na exigência de compreensão."] },
        { "numero": "1.5", "titulo": "Síntese", "ideias_centrais": ["Cuidado e controle não se opõem: a analítica não opta entre eles porque a oposição perde consistência."] }
      ]
    },
    {
      "numero": "2",
      "titulo": "Dispositivo da aids",
      "tese_do_capitulo": "A aids não é entidade clínica anterior aos discursos que a nomeiam, mas acontecimento histórico; o discurso preventivo jamais incidiu sobre populações previamente dadas, mas sobre populações que precisou produzir — e o PCDT herda e reorganiza essa lógica.",
      "ideias_centrais": [
        "Barata: a cobertura televisiva (o Fantástico) constituiu o horizonte de inteligibilidade da aids no Brasil, com a passagem de 'grupo de risco' a 'comportamento de risco'.",
        "Herzlich e Pierret: a imprensa 'fez existir a aids'; a noção de 'grupo de risco' desliza de associação probabilística a nexo causal.",
        "Perlongher: a aids 'chegou nos braços da moda'; o pânico excede a incidência e a prevenção converte-se em repressão (Serra Pelada); há descompasso entre o modelo importado e as homossexualidades populares.",
        "De la Dehesa: dos anos 1980 (movimento sanitário, ONGs, SUS, direito à saúde) aos anos 1990, a rede converte-se em governamentalidade em rede (Banco Mundial, editais, agentes multiplicadores).",
        "Pelúcio e Miskolci: a 'SIDAdanização' produz um sujeito responsabilizado e autovigilante; a seletividade do dispositivo gera uma 'ironia mortal'.",
        "A defasagem entre a população pressuposta e a encontrada retorna, em outra escala, na distância entre o adolescente do PCDT e o dos serviços."
      ],